name,organization,short_description,long_description,category,application_status,deadline,city,latitude,longitude,application_url,logo_url,tags
"Halton Hills Environmental Steward","Town of Halton Hills","Join local conservation projects to restore biodiversity in Georgetown green spaces.","Stewards participate in tree planting, invasive plant removal, and trail maintenance events. Role focuses on improving the ecological health of the regional trail network. A great way for students to gain outdoor experience and environmental literacy.","volunteering","rolling","","Georgetown",43.6477,-79.9253,"https://www.haltonhills.ca/","","environment,volunteering,halton-region,georgetown,conservation"
"Mackenzie Health HR Intern","Mackenzie Health","Gain experience in healthcare human resources and recruitment in Vaughan.","Interns assist with applicant screening, onboarding logistics, and administrative support for the HR team. This role provides insight into the staffing and operations of a major regional hospital. Coordinated through school board co-op offices.","internship","seasonal","","Vaughan",43.8582,-79.5165,"https://www.mackenziehealth.ca/","","admin,internship,york-region,vaughan,healthcare"
"Joseph Brant Hospital Admin Intern","Joseph Brant Hospital","Explore healthcare administration through a non-clinical hospital placement.","Interns assist with filing, registration logistics, and departmental administration in Burlington. This role provides immersive experience in hospital operations and prepares students for careers in management or health sciences. Coordinated through co-op offices.","internship","seasonal","","Burlington",43.3255,-79.7990,"https://www.josephbranthospital.ca/","","admin,internship,halton-region,burlington,healthcare"
"U+ Community CIT Leader","U+ Community","Mentor younger campers and develop leadership skills at summer hubs in Peel.","Counsellors-in-Training assist staff in delivering games, activities, and educational modules. The role focuses on group management, conflict resolution, and peer mentorship. A great pathway to future employment in recreation or childcare.","leadership","seasonal","2028-01-01","Mississauga",43.5890,-79.6441,"https://www.peeleducation.org/","","leadership,peel-region,mississauga,summer-camp,youth"
"Keep Durham Beautiful Data Lead","Keep Durham Beautiful","Track and analyze litter collection metrics to support municipal reporting.","Data leads manage the reporting of cleanup outcomes, identifying trends in neighborhood waste. This role focuses on data science within the environmental sector and helps evaluate the impact of regional conservation programs. ideally suited for students with analytical interests.","leadership","rolling","","Whitby",43.8975,-78.9429,"https://www.keepdurhambeautiful.org/","","data,leadership,durham-region,whitby,environment"
"Mackenzie Health Wayfinding Vol","Mackenzie Health","Help patients and visitors navigate the hospital facility at Richmond Hill.","Volunteers provide directions, escort guests to clinical units, and answer general inquiries. This role is critical for improving the patient experience and ensuring smooth hospital navigation. Requires a friendly demeanor and consistent weekly commitment.","volunteering","rolling","","Richmond Hill",43.8837,-79.4447,"https://mackenzie.vsyslive.com/","","patient-support,hospital,york-region,richmond-hill,volunteering"
"Joseph Brant Hospital Fracture Clinic Vol","Joseph Brant Hospital","Support staff and patients in the acute care fracture clinic in Burlington.","Volunteers assist with clinic flow, greeting patients, and providing simple instructions during their visits. This role provides significant exposure to a fast-paced clinical environment. Requires mandatory health screening and reliable weekly attendance.","volunteering","rolling","","Burlington",43.3255,-79.7990,"https://www.josephbranthospital.ca/","","health,hospital,halton-region,burlington,volunteering"
"Achēv Civic Action Member","Achēv","Join a hybrid program to design advocacy campaigns on local social issues.","Members collaborate on real-world projects focused on civic engagement and community impact. The program provides training in governance, media, and technology to help youth excel in community leadership. Open to diverse youth populations in Mississauga and Brampton.","leadership","rolling","","Mississauga",43.5890,-79.6441,"https://achev.ca/","","civic,leadership,peel-region,mississauga,advocacy"
"Visions of Science Hub Coordinator","Visions of Science","Assist with the logistical operation of STEM workshops in Toronto community hubs.","Coordinators manage equipment setup, student registration, and session logistics. This role focuses on operational support for educational programming in priority neighbourhoods. Provides exposure to non-profit management and community engagement.","volunteering","rolling","","Toronto",43.6532,-79.3832,"https://www.vosnl.org/","","admin,volunteering,toronto,equity,stem"